Name,Description,Latitude,Longitude ,InfoURL,ImageURL
UCSB,A great university located along the California coastline,34.416929,-119.845991,"https://en.wikipedia.org/wiki/University_of_California,_Santa_Barbara",http://web.physics.ucsb.edu/~Women/images/ucsb-big.jpg
Six Flag Magic Mountain,"A great amusement park with tons of my favorite rollercoasters, especially the one with Batman theme.",34.4253,-118.5972,https://www.sixflags.com/magicmountain,https://www.dailynews.com/wp-content/uploads/2021/03/LDN-L-MAGIC-MOUNTAIN-0318-FEATURED-1.jpg?w=620
Bonchon,My favorite fried Korean chicken restaurant.,34.1018304,-118.1104309,https://bonchon.com/,https://s3-media0.fl.yelpcdn.com/bphoto/nw8b_M4hSy_MT7itnTFb6w/348s.jpg
Yosemite National Park,One of the most beautiful national park in California I have ever seen.,37.8651,-119.5381,https://www.nps.gov/yose/index.htm,"https://media.cntraveler.com/photos/5b71a3d92211d70d9158ae1a/16:9/w_3344,h_1881,c_limit/Yosemite_GettyImages-632167865.jpg"
Lompoc Airport,A place that is good for skydive.,34.6666,-120.4606,https://en.wikipedia.org/wiki/Lompoc_Airport,https://upload.wikimedia.org/wikipedia/commons/thumb/4/4a/Lompoc_Airport.jpg/1200px-Lompoc_Airport.jpg
The Metropolitan Museum of Art,One of my favorite muserums to go. There are amazing art work.,40.7794,-73.9632,https://www.metmuseum.org/,https://www.metmuseum.org/ghidorah/assets/images/meta-image.jpg